[
  {
    "subscriptionName": "Subscription_Mail",
    "userName": "DEF",
    "repeat": false,
    "created": "data-time",
    "notificationType": "MAIL",
    "notificationMeta": "example@ericsson.com",
    "restPostBodyMediaType": "application/json",
    "notificationMessageKeyValues": [
      {
        "formkey": "",
        "formvalue": "@"
      }
    ],
    "requirements": [
      {
        "type": "ARTIFACT_1",
        "conditions": [
          {
            "jmespath": "gav.groupId=='com.mycompany.myproduct'"
          },
          {
            "jmespath": "testCaseExecutions[?testCase.conclusion == 'SUCCESSFUL' && testCase.id=='TC5']"
          }
        ]
      },
      {
        "type": "ARTIFACT_1",
        "conditions": [
          {
            "jmespath": "gav.groupId=='com.mycompany.myproduct'"
          },
          {
            "jmespath": "testCaseExecutions[?testCaseStartedEventId == '13af4a14-f951-4346-a1ba-624c79f10e98']"
          }
        ]
      }
    ]
  },
  {
    "subscriptionName": "Subscription_Rest_Params_in_Head",
    "userName": "DEF",
    "repeat": false,
    "created": "data-time",
    "notificationType": "REST_POST",
    "notificationMeta": "http://${rest.host}:${rest.port}${rest.endpoint}",
    "restPostBodyMediaType": "application/json",
    "notificationMessageKeyValues": [
      {
        "formkey" : "",
        "formvalue" : "@"
      }
    ],
    "requirements": [
      {
        "type": "ARTIFACT_1",
        "conditions": [
          {
            "jmespath": "gav.groupId=='com.mycompany.myproduct'"
          },
          {
            "jmespath": "testCaseExecutions[?testCase.conclusion == 'SUCCESSFUL' && testCase.id=='TC5']"
          }
        ]
      },
      {
        "type": "ARTIFACT_1",
        "conditions": [
          {
            "jmespath": "gav.groupId=='com.mycompany.myproduct'"
          },
          {
            "jmespath": "testCaseExecutions[?testCaseStartedEventId == '13af4a14-f951-4346-a1ba-624c79f10e98']"
          }
        ]
      }
    ]
  },
  {
    "subscriptionName": "Subscription_Rest_Auth_Params_in_Head",
    "userName": "DEF",
    "repeat": false,
    "created": "data-time",
    "notificationType": "REST_POST",
    "notificationMeta": "http://${rest.host}:${rest.port}${rest.endpoint.auth}",
    "restPostBodyMediaType": "application/x-www-form-urlencoded",
    "notificationMessageKeyValues" : [
      {
        "formkey" : "json",
        "formvalue" : "{parameter: [{ name: 'parameter', value : testCase.conclusion }]}"
      },
      {
        "formkey" : "Authorization",
        "formvalue" : "Basic TXkgQ2F0IFNtdWxhbiBMaWtlcyBUbyBmZXRjaCBjb21wdXRlciBtb3VzZXM="
      }
    ],

    "requirements": [
      {
        "type": "ARTIFACT_1",
        "conditions": [
          {"jmespath": "gav.groupId=='com.mycompany.myproduct'"},
          {"jmespath": "testCaseExecutions[?testCase.conclusion == 'SUCCESSFUL' && testCase.id=='TC5']"}
        ]

      },
      {
        "type": "ARTIFACT_1",
        "conditions": [
          {"jmespath": "gav.groupId=='com.mycompany.myproduct'"},
          {"jmespath": "testCaseExecutions[?testCaseStartedEventId == '13af4a14-f951-4346-a1ba-624c79f10e98']"}
        ]
      }
    ]
  }
]
