[
{
    "subscriptionName": "Subscription_Test_3",
    "repeat": false,
    "created": 1523473956269,
    "notificationType": "REST_POST",
    "notificationMeta": "http://eiffel-jenkins3:8080/job/ei-artifact-triggered-job/build",
    "restPostBodyMediaType": "application/x-www-form-urlencoded",
    "notificationMessageKeyValues": [
      {
        "formkey": "json",
        "formvalue": "{parameter: [{ name: 'jsonparams', value : to_string(@) }]}"
      }
    ],
    "requirements": [
      {
        "conditions": [
          {
            "jmespath": "identity=='pkg:maven/com.mycompany.myproduct/artifact-name@1.0.0'"
          }
        ]
      }
    ]
  }
]