[
  {
    "subscriptionName": "Subscription_Test_1",
    "repeat": false,
    "created": 1523473956269,
    "notificationType": "MAIL",
    "notificationMeta": "mail1@company.com",
    "restPostBodyMediaType": "application/x-www-form-urlencoded",
    "notificationMessageKeyValues": [
      {
        "formkey": "json",
        "formvalue": "{parameter: [{ name: 'jsonparams', value : to_string(@) }]}"
      }
    ],
    "requirements": [
      {
        "conditions": [
          {
            "jmespath": "split(identity, '/') | [1] =='com.mycompany.myproduct'"
          }
        ]
      }
    ]
  },
  {
    "subscriptionName": "Subscription_Test_2",
    "repeat": false,
    "created": 1523473956269,
    "notificationType": "MAIL",
    "notificationMeta": "mail2@company.com",
    "restPostBodyMediaType": "application/x-www-form-urlencoded",
    "notificationMessageKeyValues": [
      {
        "formkey": "json",
        "formvalue": "{parameter: [{ name: 'jsonparams', value : to_string(@) }]}"
      }
    ],
    "requirements": [
      {
        "conditions": [
          {
            "jmespath": "split(identity, '/') | [1] =='com.mycompany.myproduct'"
          }
        ]
      }
    ]
  },
  {
    "subscriptionName": "Subscription_Test_3",
    "repeat": false,
    "created": 1523473956269,
    "notificationType": "MAIL",
    "notificationMeta": "mail3@company.com",
    "restPostBodyMediaType": "application/x-www-form-urlencoded",
    "notificationMessageKeyValues": [
      {
        "formkey": "json",
        "formvalue": "{parameter: [{ name: 'jsonparams', value : to_string(@) }]}"
      }
    ],
    "requirements": [
      {
        "conditions": [
          {
            "jmespath": "split(identity, '/') | [1] =='com.mycompany.myproduct'"
          }
        ]
      }
    ]
  }
]