[
  {
    "created" : "2017-07-26",
    "notificationMeta" : "http://127.0.0.1:3000/ei/test_subscription_rest",
    "notificationType" : "REST_POST",
    "restPostBodyMediaType" : "application/x-www-form-urlencoded",
    "notificationMessageKeyValues" : [
      {
        "formkey" : "e",
        "formvalue" : "{parameter: [{ name: 'jsonparams', value : to_string(@) }, { name: 'runpipeline', value : 'mybuildstep' }]}"
      }
    ],
    "repeat" : true,
    "requirements" : [
      {
        "conditions" : [
          {
            "jmespath" : "test_suite[?test_case.test_data.tracker == 'My Test Management System' && test_case.test_data.id == 'TC-1234']"
          }
        ],
        "type" : "TEST_EXECUTION_1"
      }
    ],
    "subscriptionName" : "Subscription_Test",
    "userName" : "ABC"
  }
]